username,comment,comment_time,like_counts
乌鲁克之王金皮卡,前面好像刀剑第一季op2,2022年3月17日,(0)
乌鲁克之王金皮卡,虽然不管是从画面，打击感还是剧情和原神比差距都不小，但是，萌新开图到处捡东西真的太好玩啦，哪里都不行，但是真的很好玩,2022年3月17日,(3)
乌鲁克之王金皮卡,我两边都玩，前两天才入坑幻塔，画面，打击感等等确实跟原神差距还不小，但我本身挺喜欢MMO类的，玩着感觉还行,2022年3月17日,(1)
tiffanysooi,毕竟这两个玩家群体之间吵架的源头是幻塔官方的一些运营操作，从内测开始就宣传并标榜幻塔是原神竞品，去年原神争议最大的时候也下场踩一脚。现在游戏质量没上来再对应之前官方的一系列举动评论区不难有骂战,2022年3月16日,(0)
廿三年夏-沁湖,烟火绽放，乐曲想起的时候，停住了脚步，完全沉静在这种氛围里，烟火温暖而美丽，音乐优美而感动。游戏之余，很享受这片刻的驻足。,2022年3月16日,(3)
廿三年夏-沁湖,就探索肝一点，其它还好，探索度100%后，很闲的,2022年3月16日,(0)
廿三年夏-沁湖,我是在旋转木马上听到的，觉得超级好听，就找到这儿了,2022年3月16日,(0)
彼岸azj,现在每天上游戏也很无聊，听到这首歌，又不想弃了。,2022年3月16日,(0)
康米归来,期待维拉,2022年3月16日,(0)
Type_Ki,打卡 还在玩幻塔 原神也在玩,2022年3月16日,(1)
追忆着你,有些地方翻译的还不错的,2022年3月15日,(0)
旅人空和他的老婆魈大人,😭😭😭我永远喜欢奈美西斯,2022年3月15日,(0)
Doppler丶,只能说不太符合，没必要。但网易云说没明显错误，也对。。,2022年3月14日,(0)
LoveNoelle,我本来重译了一个 然而网易云说 没有明显错误 我不能理解,2022年3月14日,(0)
Doppler丶,雅过头了,2022年3月14日,(0)
千丶凌羽,我知道原神有组队但他的玩法更多都偏向个人玩法,2022年3月14日,(0)
Kakigoori_,有股尼尔的味道,2022年3月13日,(1)
梧桐子_YpDd,"其实如果幻塔先出来，bug、瓜再少一点，在中国手游市场做的算很不错了，应该是能吸引很多玩家的。但是
Genshen先出来了，相比之下就逊色不少，而且一测时呈现的质量又确实拉垮，所以就。。。幻塔最大的问题就是不该标榜原竞品、下一个TGA，他可以去追逐这个，也应该追逐，但说出来就是另一回事了。",2022年3月13日,(2)
AuCarmen,开预捏脸的那天，就这intro听了好久，给了我灵感,2022年3月13日,(1)
梧桐子_YpDd,原神有组队呀,2022年3月13日,(1)
FCLONELY-YYDS,love HUANTA&HOTTA STUDIO forever,2022年3月12日,(1)
晚星奈奈,我已经玩了几个月了,2022年3月12日,(0)
千丶凌羽,来看了评论区感觉都是在吵架的突然觉得很没意思，你们说的崩坏3原神幻塔我都玩过，我觉得吧萝卜青菜各有所爱，因为崩坏出来的早所以玩了很长时间后来接触的原神感觉玩不起劲新鲜劲过了就觉得没意思了，我玩幻塔主要是比较喜欢这种题材风格而已我也比较喜欢组队而不是单机，这是原神和崩坏所没有的。,2022年3月12日,(6)
楪舞願,啊这，属于是一个苦海跳进另一个苦海,2022年3月12日,(3)
火暴月干了,我今天也卸了，打算和同学一起玩原神去了[多多笑哭],2022年3月11日,(1)
废青袍,你骂谁?,2022年3月11日,(3)
oO本昵称已被占用,战双口碑好？不是开战，我当初就是因为战双的打击感退坑的。当初也没见的有多好(￣▽￣),2022年3月11日,(0)
唐冰瑶殿下,海子哥连吃我五局分[多多大哭],2022年3月11日,(0)
林青筑,希望我和你可以一起走下去,2022年3月10日,(0)
SuperMario0,op收收味,2022年3月10日,(3)
kzyuivk,我想起了刚刚开始根本等不来的烟花，和完成不了的烟花支线。。,2022年3月10日,(0)
子虚乌白,这游戏目前没有替代品是事实，其他游戏任你强不是一个类型的。,2022年3月10日,(0)
胖才才2009,🤓🤓消失的快乐，到此一游,2022年3月9日,(0)
啾咪的阿网,幻塔不倒，海德嘉TH04陪你到老,2022年3月9日,(0)
塞西莉亚六相冰,有神番开头曲那味了,2022年3月9日,(2)
云村村民162891064243955,然后幻塔跟诺亚之心一比，真挺挺好的了,2022年3月9日,(1)
喂110吗_小伙子,白鲸岛的夜晚，烟花和你都是那么美丽,2022年3月8日,(4)
一叶若知天下秋,兄弟，收回祝福吧，人家只想学贪玩蓝月＋传奇,2022年3月8日,(1)
爱伦伽勒尔,我已经满星的但是雷刀版本退游了,2022年3月7日,(0)
rhyrive,确实，原神万氪开服玩到海岛就退了，而幻塔开服到现在也觉得挺好，可能这种mmorpg更适合我🤔,2022年3月7日,(0)
LoveNoelle,这翻译的是不是有些雅而不达,2022年3月7日,(4)
団长-,这真完全看脸。反正我幻塔是硬吃满了四次常驻保底，三次限定保底歪了两次。非要说的话反而是原神越靠近保底概率越高，90发吃满保底概率比单抽出金还低，基本都是60到80发出金，我上个池子甚至20发出钟离。不过说氪的话原神确实氪，强氪真搞不起。,2022年3月7日,(0)
不会拉刀光的童人,音乐做的比游戏强,2022年3月7日,(3)
蛇皮走音,难怪耳熟原来是幻塔，歌神仙游戏狗都不玩,2022年3月7日,(3)
柳暗香,😅差不多得了,2022年3月6日,(2)
柳暗香,祝好,2022年3月6日,(2)
洛伦诺里萨,我也是，forever!,2022年3月6日,(0)
洛伦诺里萨,渠道服大佬少，各种排名还靠前点。有利就有弊,2022年3月6日,(0)
洛伦诺里萨,我第一次在白鲸岛听到这首歌也是觉得很惊艳，看着满天的烟花绽放，觉得很美！,2022年3月6日,(1)
洛伦诺里萨,为什么不玩了？后面还有维拉大陆，这仅仅是个开始。,2022年3月6日,(1)
晚星奈奈,玩两个月了，今天刚刚准备卸载的时候，白鲸岛正好放烟花响起了这bgm，有点小感动，算是这游戏和我的告别吧，再见,2022年3月6日,(38)
oO本昵称已被占用,排队中……预计5个小时(￣▽￣),2022年3月6日,(0)
小丑亦或王牌,路还很长,2022年3月6日,(1)
夢祈iR,都听歌来的，别提别的游戏啊,2022年3月5日,(2)
Passky,看板娘(,2022年3月5日,(0)
无恙既安,原来这首歌这么早就出了,2022年3月5日,(1)
浅梦亦无痕,我喜欢这首歌,2022年3月4日,(1)
易真的涵,荒邻镇HT07永不退游，陪你到老！,2022年3月4日,(0)
易真的涵,现在塔塔已经往好了做了，策划用心了,2022年3月4日,(0)
易真的涵,荒邻镇HT07，我们永远在！,2022年3月4日,(2)
blooddegree,幻塔呈现出的剧情耐推敲程度、人物形象的塑造和游戏内容的细腻精致程度 并没有这一首歌蕴含的宏大世界感和末世内的情感多。,2022年3月4日,(13)
川渝_OvO,爬就行，俩头像框我都有,2022年3月4日,(0)
楊杨yangYH,幻塔不倒，海德嘉TH02陪你到老,2022年3月3日,(4)
浮城181004,从开服玩到现在才刚完成看烟花的支线，感动到我了,2022年3月3日,(1)
风寐,如果不那么肝的话，我倒是会坚持下去。（玩了几天就弃游的人路过）,2022年3月3日,(0)
_已经是废喵了_,一样,2022年3月3日,(0)
_已经是废喵了_,就是这剧情嘛.....一言难尽,2022年3月3日,(3)
阳光微凉181118,因为它只是个单机,2022年3月3日,(2)
Asgard-7,在白鲸岛挂着木马刷游玩劵，突然响起来这首歌，真的是突然被惊艳了…第一次被塔塔感动到,2022年3月3日,(8)
十六夜与星,你往外跳，点飞行器，再点一下跳。就可以扒在凸起来的上面的墙上了。,2022年3月3日,(1)
笨笨狗ailyc,啊这..好像差不多…都很高！[多多捂脸],2022年3月3日,(2)
啊咿呀喂哟喔,守护艾达星！,2022年3月3日,(0)
西莉卡酱,我两个游戏都喜欢！,2022年3月3日,(1)
摇曳瑶,这歌词是真的好美,2022年3月3日,(0)
Sun郝晨不沉,都不是一回事，迷你是照搬mc连代码都抄，幻塔我承认和原神一样都是大世界游戏，抄的成分不能说没有，但绝对没有照搬，像幻塔有PVP是吧，总之各有特色，我玩幻塔是因为我看灵笼，而幻塔和灵笼联动了，现在玩下来，觉得也还行的,2022年3月3日,(6)
千丶凌羽,幻塔和寒天之钉哪个高啊,2022年3月3日,(1)
千丶凌羽,你们是怎么跑到幻塔顶上去的,2022年3月3日,(0)
_庭園_,22点的白鲸岛烟花，24点的幻塔顶流星雨，这就是末世的希望之光吧。,2022年3月3日,(2)
七分糖好喝,让我留在幻塔的，是莎莉。我的天使，终于等到你，我来了。,2022年3月3日,(2)
辰汐丷,因为支线19点传到白鲸岛 伴随烟花响起的Bgm 听完莫名感动.,2022年3月3日,(1)
千丶凌羽,所以进去右边有个五角星浮标的是什么渠道服，没玩到官服的我知道的时候已经氪了几千进去了结果发现是渠道服人都傻了,2022年3月3日,(1)
U的面包房,希望塔塔越来越好，就如歌所说的 To the end of the time，none us will say good bye,2022年3月2日,(1)
乜夜灵,听歌，不聊别的,2022年3月2日,(0)
原批偷盘子,op米站待的不够还要来这里搞团建啊,2022年3月2日,(4)
帅帅_rNQq,白鲸岛,2022年3月1日,(1)
saber_OSIy,米哈游的幻塔太好了，幻塔，。,2022年3月1日,(1)
初云姥,"虽然一个游戏下面最好别提其他游戏 但是如果有尼尔玩家是否在白鲸岛听到这首曲子的时候 会想起和2B,9S奋战的那一个游乐场呢",2022年3月1日,(0)
Whovian_Z,确实[多多笑哭],2022年3月1日,(3)
唐冰瑶殿下,有bug，只不过大佬都在恰独食,2022年2月28日,(0)
是如雨呀,找到了 谢了,2022年2月28日,(0)
丶嵐先森,幻塔组曲01 Main Theme,2022年2月28日,(0)
小丸子你可知爷爷年轻的时候,大爱这首歌,2022年2月28日,(0)
别等待时光总是变幻,飞去白鲸岛听到这首歌惊艳到了，现在听这歌挺怀念玩幻塔的那段过年的时光,2022年2月28日,(1)
是如雨呀,“再过多少年之后，原神也会落寞” 这句话甚至有点虚无主义的味道了 而且在我看来最大的问题也在于此 先说说前半句 感情你是从2050年穿越过来写下这条评论的? 我明白 一款游戏有自己的寿命 落寞确实不可避免 所以呢？评价一款游戏的标准不应该是其质量么？和落寞有什么关系 你这不是耍流氓么,2022年2月28日,(4)
是如雨呀,4.什么是垃圾的玩家? 你这话看似很有道理 实际上需要很多限制条件才能成立 另外 这句话过于绝对 我的建议是实事求是一点 具体问题具体分析 “没有垃圾的游戏，只有垃圾的玩家”实际上是忽视了游戏质量客观事实的存在 只关注于玩家即人的主观能动性 这样的做法并不妥当,2022年2月28日,(6)
是如雨呀,"首先 对评论不对人 其次 我也不懂哲学这深奥的东西 但你给人的感觉是 你也只是学过罢了
“没有垃圾的游戏，只有垃圾的玩家”我的建议是 你不妨把话说的直白一些 不要在这里光放下一句看似很有道理的话 我问你四个问题哈 1.什么是游戏? 2.什么是垃圾的游戏? 3.如何确定一个玩家真的是玩家?",2022年2月28日,(3)
是如雨呀,只能说是互联网现状吧 前几楼还好 越到后面越无奈 甚至你都没提原神 然后就被扣帽子了2333,2022年2月28日,(4)
是如雨呀,"前不久刚退坑 游戏质量提升空间感觉还是挺大的 我只能给三分（五分制） 希望能越做越好吧
还有一件比较可惜的事情 网易云似乎没有登录界面的那个版本 更喜欢那个一点",2022年2月28日,(0)
哦嗯哼哈喽,我是幻塔刚出不久就开始玩了，偶然在白鲸岛听到这首歌就想着下载来听。,2022年2月27日,(2)
中二的宸宸,赛弥尔没人要我就抱走了,2022年2月27日,(0)
梦洛凋零,星岛3，梦洛凋零，前来报道,2022年2月27日,(0)
Passky,这首歌制作确实好.,2022年2月27日,(0)
泡面小小陈,IOS系统，ID：泡面小良 等待熟人,2022年2月27日,(1)
银牙不是熊猫,现在幻宝开始偷偷摸摸半夜修bug然后偷偷更新，不发邮件墨晶补偿了,2022年2月27日,(4)
彡笙丶歌丿,对对对，我轻浮，你可太高雅了，给自己立什么牌坊呢😅,2022年2月27日,(0)
MingleJ,不是吧，op都找到这了，可怕[西西呕吐],2022年2月27日,(0)
VERVIE,拓荒者是按照个人喜好捏的。在白鲸岛驻足的时候，绚丽的烟花配上这首BGM，真的给我一种恋爱般的感动,2022年2月26日,(0)
村至圣,拌鸡丝1 锁牛小童来咯,2022年2月26日,(0)
欲望能力不匹配,加油幻塔 越做越好 可别辜负我们啊♥,2022年2月26日,(3)
欲望能力不匹配,从内测的时候看到幻塔的，到公测也是玩到现在 现在也是要出新版本了 ，在这也是希望塔塔越做越好，不要辜负了我们.正如歌中唱到的“Like you and I are meant to be.”也是想和塔塔走下去 虽然有时候塔塔可能做的不是很好 但是我会坚持继续玩下去直到forever,2022年2月26日,(5)
Uninhibitad,烟花好看！,2022年2月26日,(0)
桓那兰的比格,好家伙可以,2022年2月26日,(1)
笼具,一次刷游玩卷的时候听到的，挺好听的，不知道叫什么，今天找到了，最后，塔塔加油[多多大笑],2022年2月26日,(1)
因幡月色,终章boss我打了一个多小时[多多大哭],2022年2月26日,(1)
纸月空鱼,穷批是不是不知道有个词叫pc端啊,2022年2月25日,(2)
小忽悠就是在下,氪了十几万吧，退坑两次，游戏有他好的地方，要不然也不会退坑一次还要再入坑一次，这次告别幻塔可能要久一些了，希望塔塔会越来越好。。。,2022年2月25日,(14)
川渝_OvO,真的很好听,2022年2月25日,(0)
命运指定,这几年除了平安京，就幻塔能在我手机玩超过十分钟，不错的游戏，最喜欢的网游是龙之谷，幻塔缺点多，但优点显而易见。,2022年2月24日,(0)
周某偷电瓶zhoumo,我主线剧情刚做完从星岛传到白鲸岛找弗兰茨，结果突然放起了这音乐，我以为这是剧情做完才会有，那时候特后悔没录屏下来，没想到是烟火表演的,2022年2月24日,(2)
Passky,好听,2022年2月24日,(0)
Lrkious,haggstrom,2022年2月24日,(0)
Lrkious,我怎么感觉前奏的三个音和mc的某首背景音乐里的好像啊，是我幻听了吗,2022年2月24日,(1)
宇宙第一IDE,BV1yT4y1D7vB,2022年2月24日,(0)
宇宙第一IDE,op收收味，大家是来听歌的，不要影响大家的心情。美好的一天从看到op结束。,2022年2月24日,(1)
宇宙第一IDE,经典别人说什么我都信，自己去b站看看，反转了,2022年2月24日,(0)
宇宙第一IDE,op无处不在,2022年2月24日,(7)
一只垮脸熊,op是这样的，你和那种没成年的人计较什么,2022年2月24日,(38)
bigaxe,当时我正在白鲸岛骑摇摇马刷游乐卷，结果突然背景变了。我还纳闷这游戏还带改背景音乐的？然后这首歌就响起了，我就呆呆的站在摇摇马那里，一直听完，突然发现我已经很多年没有给一首游戏背景音乐驻足过，上次的停留还是在仙剑的《龙影随风》,2022年2月23日,(4)
小芽败,喜欢就玩 不喜欢就不玩 如果是因为跟风为了喷游戏而还在坚持玩 那真的没有必要捧一踩一 幻塔跟原神也不对标 想当初原神刚出的时候 我也去尝试玩过 但是我还是觉得塞尔达yyds 幻塔有很多问题可以提出来 鞭策 但真不用一有开放世界的游戏 就在里面高潮 （第一次听到这首歌 心情正不好 直接被治愈到了）,2022年2月23日,(3)
185kg极品私斋,评歌不评游，这歌是真好听ヾ(Ő∀Ő๑)ﾉ,2022年2月22日,(1)
多些耐心,真好啊,2022年2月22日,(0)
笨笨狗ailyc,哈哈,2022年2月22日,(0)
笨笨狗ailyc,原神应该说是主单机,2022年2月22日,(7)
笨笨狗ailyc,你这是在让毕加索照着梵高的画来画吗？一个主单机，一个主联机两个游戏的储存方法都不一样。为什么原神10几个G，而幻塔小？就是因为人家幻塔服务器在完美世界那里，我们手机储存，云端传输存档。而原神的主机就是房主，存档都在房主设备上。他俩储存方式都不一样怎么照版？,2022年2月22日,(5)
笨笨狗ailyc,还有就是，你现在把游戏下回来玩玩吧！现在bug少了很多很多，好久没听见有bug了。没错，刚开服事确实很多，但是现在人家成长的成果已经能够看见了。,2022年2月22日,(5)
笨笨狗ailyc,还有，幻塔服务器维护是要费用的。原神相当于把游戏给你你自己搞单机，他们不需要维护什么服务器，服务器主机就是房主。原神也到处都是挂只是你看不见罢了。幻塔这游戏能少占你多少内存不懂吗？人家手机内储存上传服务器就是这么回事，他本该让你下载10G以上的安装包。他为什么要搞多人？,2022年2月22日,(6)
笨笨狗ailyc,你没发现吗，幻塔的bug全建立在自由度和创新之上。你有没有觉得玩幻塔跑图比原神舒服多了？从头清算bug“载具，电磁炮变小人物”“无限使用驾驶类源器”“爬墙下坠攻击卡无限攻速”“卡住脱离还原周目导致无限卡墨晶”这些的初衷都是让玩家有更好的体验，有人去找bug是好事，发现了才能去修,2022年2月22日,(8)
笨笨狗ailyc,你太高看迷你了，宝宝玩的游戏别在这拿来比喻好吗？,2022年2月22日,(5)
笨笨狗ailyc,说实话，原神比幻塔氪多了。我抽个零命甘雨和阿莫斯一共花了2100元，全吃的保底。原神真的像无底洞一样，太氪了。幻塔还算好，不吃保底，日常维护给的墨晶也很多。活动也很多，我现在满星镰刀和满星冰弓都是靠肝肝出来的，并且我在这游戏里面捏的是我人设。我可以不去xp抽卡，我自己喜欢什么捏什么。,2022年2月22日,(37)
笨笨狗ailyc,说实话，原神比幻塔氪多了。我抽个零命甘雨和阿莫斯一共花了2100元，全吃的保底。原神真的像无底洞一样，太氪了。幻塔还算好，不吃保底，日常维护给的墨晶也很多。活动也很多，我现在满星镰刀和满星冰弓都是靠肝肝出来的，并且我在这游戏里面捏的是我人设。我可以不去xp抽卡，我自己喜欢什么捏什么。,2022年2月22日,(0)
笨笨狗ailyc,还有，你带给人的第一感就是轻浮的一个人。希望你生活不是如此吧！,2022年2月22日,(2)
笨笨狗ailyc,这就跟你拿毕加索的画去跟梵高的画比，风格，都不一样比什么啊？,2022年2月22日,(0)
丷双子座,迷你元神世界？,2022年2月22日,(4)
慕家门,没办法，原神质量确实高，玩家也确实会越来越多的,2022年2月22日,(9)
Sun5hy,那些高楼顶部老是有一坨突出来的，那一坨是爬不上去的，贼反人类,2022年2月22日,(0)
Sun5hy,官方故意给我们送墨晶有啥不好，我还是希望他天天送我300墨晶呢,2022年2月22日,(1)
无奶油咖啡,闻着味，追到网易云来喷，真牛,2022年2月21日,(3)
无奶油咖啡,Op开到网易云来了,2022年2月21日,(7)
啵酱_n,不得不说这音乐再配上烟花是真的不错昂,2022年2月21日,(1)
秋沐玊,玩过幻塔10分钟，但这首歌真的好听。,2022年2月21日,(1)
某科学的超帅气圣柒,今天刷票的时候听到了，真的好听[多多大笑],2022年2月21日,(0)
去四川看海,白鲸岛夜晚也放这曲，幻塔加油啊,2022年2月21日,(2)
00后白羊座,同意，莫名就是想玩下去,2022年2月21日,(5)
笨笨狗ailyc,这是伴奏版的,2022年2月21日,(0)
笨笨狗ailyc,Meant to be （Instrumental）,2022年2月21日,(0)
笨笨狗ailyc,总之都是国产游戏，希望游戏会做的越来越好！我很感谢各游戏的制作人员，不管是不是游戏公司为了圈钱。但是你们制作游戏的心意与投入绝对是至高无上的。加油吧！,2022年2月21日,(36)
笨笨狗ailyc,是真的，拿幻塔和原神比实在不大好。我是两个游戏都玩，讲真的我都很喜欢。我个人是个喜欢冒险，剧情，pvp的玩家。原神节奏慢，画质唯美悠闲。幻塔节奏稍快，但是自由度高。我真的不喜欢拿这两个游戏比来比去。不是一个游戏多好就能封杀圈内的所有游戏。也不是一个游戏有很多bug就能否定制作者的用心,2022年2月21日,(164)
Little-bustters,啊对对对，原神不是单机，你太懂了，真是太厉害啦！,2022年2月21日,(4)
瑾月kt,那西萝我就🤤,2022年2月20日,(0)
瑾月kt,只会越来越多,2022年2月20日,(7)
L_You-,好听,2022年2月20日,(0)
枯叶村,,2022年2月20日,(3)
雪落晨曦game,游戏时间22点也会唱,2022年2月20日,(0)
认真取名的御坂10032,塔塔开！,2022年2月19日,(1)
老人说遇见是福,希望塔塔越来越好，至少目前在mmo游戏里面你是很能打的[多多大笑],2022年2月19日,(4)
偷偷刚刚,曲好唱的也好歌词意境也高针不戳,2022年2月19日,(0)
偷偷刚刚,这个真不错,2022年2月19日,(0)
mampharos,白鲸岛烟花时间,2022年2月19日,(2)
修罗的猫,我现在是越来越爱玩了，这个游戏比原神更加平民化，也更加具有社交性，特别以后公会战开了，和工会里的几十个好兄弟一起打那不是很有意思,2022年2月19日,(3)
修罗的猫,策划不行，但是游戏本体还是很不错的，特别是现在很多bug已经修复了,2022年2月19日,(1)
银牙不是熊猫,每次经过白鲸岛的时候，我都会停下前行的脚步慢慢听完看完这场烟火秀，再开始自己的旅途。,2022年2月19日,(4)
冬季不会太冷,我的,2022年2月19日,(0)
JSKWOO,999+了，恭喜恭喜[多多大笑],2022年2月18日,(1)
leoooo咸蛋超人,旺旺碎冰冰,2022年2月18日,(0)
Whovian_Z,我是在骑旋转木马的时候[多多笑哭],2022年2月18日,(1)
Whovian_Z,抛开游戏不谈，这玩意还不错[西西机智],2022年2月18日,(1)
星点残光,至于剧情，我玩游戏都没怎么看过剧情，然后，卡顿啥的，手机扛得住，比较少（悄悄说一句，麒麟9000yyds），打击感，我又不是来玩动作游戏的……没怎么在意过，不过，也没必要吹幻塔，我玩个游戏，就图个开心，快乐，管他那么多干嘛，至少我玩幻塔挺爽的[多多捂脸][多多捂脸][多多捂脸],2022年2月18日,(0)
星点残光,即便如此，幻塔对我来说真的是很棒的游戏了，不否认它存在各种各样的问题，但这些，对我一个普普通通的玩家来说，我无所谓，bug多，确实没有怎么影响过我，赶不上趟吧hhh，ch装死阴间操作，玩过网易游戏的我（且还在玩），抵抗早已拉满，各种大大小小的瓜，看个乐子，没必要参与,2022年2月18日,(0)
星点残光,虽然但是，幻塔给我冲啊，塔塔开，塔塔开，塔塔开啊！[多多大哭][多多大哭][多多大哭],2022年2月18日,(2)
星点残光,即便如此，也不会妨碍我喜欢他，这个游戏对我来说真的很棒了[多多大哭][多多大哭][多多大哭],2022年2月18日,(0)
深空之中的一叶扁舟,除了MOBA以外没有任何一款游戏可以留住除了我们这种人，MC，原神，幻塔，gal，部落等等,2022年2月18日,(1)
臭崎纱夏,错误的，梅丽尔我的🥰,2022年2月18日,(0)
深空之中的一叶扁舟,过于冲突，但也确实不错,2022年2月18日,(0)
你矮你说了算,支线可以不做，但白鲸岛的烟花怎么说都不能错过,2022年2月18日,(1)
Mr飞哥与小佛,超喜欢赛弥尔的人设好吧,2022年2月18日,(0)
你矮你说了算,幻塔越来越好,2022年2月18日,(2)
宅魂上古佛,原批还真是哪哪都是，烦的一批。,2022年2月18日,(13)
小天鹅驱逐舰,海嘉德4，虽然这游戏剧情打的我脑溢血。但是不妨碍我离不开它了🤕梅丽尔，我的梅丽尔🤤🤤🤤🤤🤤,2022年2月18日,(15)
prayforu123,好听！第一次在白鲸岛听到有被惊艳到！,2022年2月18日,(4)
哲学的世界,我一直期待着和某个人去广袤的世界冒险，牵住她的手，在荒芜的铁路两旁慢慢走，夕烟与月色的光，模糊了眼中世事的严苛，淌过泥泞与高山后终究是你我追寻的乐园。,2022年2月17日,(2)
臃散,还是在白鲸岛偶然听到的，很惊艳,2022年2月17日,(5)
情感的依托,听到最好听的游戏主曲,2022年2月17日,(2)
臭崎纱夏,这也能有欧泡我是服气的,2022年2月17日,(3)
归曼S,不做支线都不知道这首歌的存在……,2022年2月17日,(4)
凉邪君,欧泡时间到～,2022年2月17日,(2)
可爱酱喵,好听,2022年2月17日,(0)
臭崎纱夏,希望你能加油啊,2022年2月17日,(0)
mc1097,早退坑了，来回忆一下,2022年2月17日,(0)
你们怕不怕,"星岛2
有意无意之间
留名",2022年2月16日,(1)
独不问-天涯恨,这首歌真的很不错。。,2022年2月16日,(0)
tandang天马行空任我行,班吉斯 彭于晏 路过,2022年2月16日,(0)
飛鳥馬時Toki,虽然但是，剧情为什么7-,2022年2月16日,(0)
手冷的小兔子,999,2022年2月16日,(0)
Mr飞哥与小佛,我不爱去游乐园，所以白鲸岛是我去的第一个游乐园，我现在超级喜欢游乐园，如果有个游乐园用这首BGM，我一定从白天待到黑夜,2022年2月16日,(4)
Bankslee,幻塔爬山都费劲，那只能建议你换电脑了,2022年2月16日,(2)
Bankslee,是人是鬼就拉胯，bug多不假，不至于拉,2022年2月16日,(2)
君陌Queemo,一开始玩的好朋友慢慢都退啦，正如我的时光一样不断的弃入废纸篓,2022年2月16日,(1)
