username,comment,comment_time,like_counts
Evithur,爱可以跨越永恒，期待和各位拓荒者在亚夏大陆相见，一起寻找希望探索美好！,2020年6月16日,(660)
凉邪君,歌曲依旧好听，游戏慢慢变好，唯一依旧烂着的就是op的素质,2022年8月3日,(535)
我怀里有个十香,原神太飘了，必须要有限制，希望你游会是下一个战双，当然，不是诅咒开服炸服也来个黑卡事件，而是希望你能像战双一样，在口碑上能够站到崩崩崩左右，唯有良性的竞争才能共同进步，玩家福利才会更好,2020年6月17日,(404)
彡笙丶歌丿,幻塔唯一的贡献就是这曲子还不错，游戏是真的拉胯,2021年12月20日,(368)
嘉心糖们今天吃什么,据我所知，刚开始，幻塔只是完美旗下的一个小工作室出品的游戏，在2018年立项，他们没有优良的制作团队，在游戏发布第一个pv，就被某个游戏的玩家群起而攻之，直到现在，他们官方也没有发表过任何一个对标某款游戏的文章，视频广告。而某游戏玩家每次在这款游戏发布任何内容的时候都会像苍蝇一样围上来,2022年5月3日,(324)
lllllttttwwww,连歌底下都有op是我没想到的,2022年2月12日,(258)
leoooo咸蛋超人,"时间2022年1月27，白月魁版本更新当天，我只是想着12点上线抽一波白老板。正好下线前就在白鲸岛，当时我还从冰箱里拿了一根冰棒叼在嘴里，完全没注意游戏，这时候突然白鲸岛上空就升起了烟花，我就这么静静地看着烟火升空，然后绽放，背景就响起来这首歌。
突然有一阵感动涌上心头，我喜欢幻塔",2022年1月27日,(224)
油焖小白菜,今天探索完了沃兰雪原，至此终于把亚夏大陆五个地图全部探索完毕。爬上了地图中心的亚夏幻塔，每爬上一个阶梯，都要环顾一下这个熟悉的大陆，逐渐发现原来白鲸岛其实并不高，星岛和雪原其实并不远，海的尽头还有若隐若现的其他大陆。最后主题曲响起，让我觉得这个游戏哪怕作为单机，也足以令我感动满足,2022年1月6日,(205)
XuYuClint,幻塔白鲸岛烟花任务的背景音乐，配合着这首歌的旋律，烟火在空中绽放，一组烟花表演，一首歌，都显得那么短暂，但却是这场如此不完美的旅行中，唯一乐意停下脚步欣赏的几分钟，也许现实并不完美，但是只要有希望，我们就拥有了前往未来的信心和动力，幻塔，加油！,2022年1月28日,(187)
笨笨狗ailyc,是真的，拿幻塔和原神比实在不大好。我是两个游戏都玩，讲真的我都很喜欢。我个人是个喜欢冒险，剧情，pvp的玩家。原神节奏慢，画质唯美悠闲。幻塔节奏稍快，但是自由度高。我真的不喜欢拿这两个游戏比来比去。不是一个游戏多好就能封杀圈内的所有游戏。也不是一个游戏有很多bug就能否定制作者的用心,2022年2月21日,(164)
水起花落,幻塔，你的作品对得起你这首歌吗,2021年12月26日,(153)
源氏爱你哟,恭喜幻塔提名TGA最佳移动游戏,2022年11月15日,(145)
Leper_,幻塔唯一能打的就是这首主题曲了……,2021年12月20日,(131)
Ridiculer,第一次听到是在幻塔的官网里，当时就觉得挺像回事，是骡子是马先玩玩看。进入游戏后就是不停的刷主线遗迹旧日世界BOSS 卷战力，逐渐忘了这首歌。直到烟花这个必须 在特定时间完成的任务，让我在晚上白鲸岛挂机等待的瞬间，惊起了鸡皮疙瘩，漫天烟花配合这首歌曲，让人沉醉，曲终而后烟花毕。,2022年1月5日,(83)
音霸大奔奔,讲真，幻塔真的是有在认真做的，1.0主线跑到白鲸岛，来到一座漂浮在空中，废弃的，没有人的游乐场，只有两个语音系统都有问题的机械智仆陪着你看着游乐场的灯火，这时主题曲就开始放，末世的感觉就来了,2022年4月29日,(78)
力金梦,这首歌白鲸岛刚听的时候就让我蚌埠住想哭 这个音乐配合风景我瞬间回想起那些年玩FF14的日子 真的没绷住😭,01:04,(1)
每节课都在睡,4.1了，幻塔也走到了国产开放世界游戏的顶峰之一,7月10日 11:50,(2)
谁能单纯一辈子,当时火炬之光关服的时候，说过度到幻塔，还送东西，因为我年纪大了，已经没有年轻时那么多时间，于是没有玩，突然有天听到这首歌，发现很像我20年轻玩过的网络游戏配乐，不知道是飞飞还是神泣了。,7月8日 14:40,(2)
咕枭,这首歌的歌词给到《星际穿越》也很应景~ ”因为爱可以跨越永恒“,7月3日 09:35,(2)
---笛子---,虽然只玩了半年，已经两年没玩过了，剧情啥的都记不起来了，但是白鲸岛上的夜景真唯美，第一次跑着跑着突然漫天烟火，这个音乐响起来，太感动了,7月2日 23:17,(5)
来自异国的诗人,新登报道！格网终端无意放出的这首歌。真好听啊。,6月27日 06:40,(4)
光明听歌ing,啊，那不是冲刺吗？,6月26日 12:11,(0)
没有萌新的音乐咸鱼,是的，你评论下面已经有这种苍蝇了,6月26日 02:36,(0)
风起鹤归楓,我也想入坑啊，主要是mmo类型游戏我玩的不久啊,6月25日 09:16,(0)
朝春理樹,我们幻塔玩家欢迎广大原祥玩家入坑，毕竟龙仆已经数值膨胀了。面且抽卡资源给的巨扣。我们幻塔就不一样了，虽然它从未停止过数值膨胀，但架不住地图资源给的多啊,6月24日 21:24,(2)
比那名居夕妍,这游戏玩家不剩多少，女玩家更是没几个，看起来没什么动力出男角色了,6月24日 09:24,(0)
周二珂珂珂珂呀,,6月21日 00:46,(1)
楊杨yangYH,他还在坚持,6月21日 00:45,(1)
周二珂珂珂珂呀,哦哦 瓦伊的公会，已经是去年的事了，那会经常一起熬夜凹起源,6月21日 00:21,(1)
楊杨yangYH,海2月汐阁,6月21日 00:19,(0)
楊杨yangYH,退坑一年了，还是忘不了这歌。再看看新角色，退坑前还抽了一个大佐，虽然很丑，因为是男的，必抽。这游戏已经没有男角色了。幻塔根本不会弄男角色,6月21日 00:17,(3)
周二珂珂珂珂呀,你是,6月21日 00:13,(1)
楊杨yangYH,哈哈，我也退了一年了。我记得你经常被拉去当黑奴奶打起源,6月21日 00:12,(1)
我TM社保卡,放心 官方放出话来说还要运营10年[多多捂脸],6月18日 23:33,(0)
一生-遗忘,白鲸岛上的绝唱！,6月12日 21:32,(1)
合冰梦幻,这首歌最后几秒钟有人说话耶 你们听到没有说的是啥呀,6月11日 21:47,(0)
安书亦y,后来我从亚夏到了网格，没事做的时候还是会去白鲸岛上玩听听这首歌。,6月6日 15:44,(5)
看到记得喊我打卡谢谢,打卡,6月3日 18:00,(1)
光明听歌ing,是的，感觉就是消耗玩家的热情，虽然我没退坑(主要是第二部有戳我的角色),6月1日 18:15,(0)
sablit,我想星岛庇护所了了 传回去看看,5月31日 09:37,(6)
断了线的风筝QwQ,没想到幻塔也有超越原神的一天,5月30日 19:10,(4)
诗情意画,塔塔，还能坚持下去吗，加油，塔塔越来越好了！,5月29日 21:24,(2)
达皮卡,确实,5月29日 20:43,(0)
贤贤-抱抱芙芙版,我不是一定要整个什么，我只是想说这两个不是一个东西，我就一个臭玩游戏的我一天看着各种游戏视频下面乌烟瘴气的我也烦啊（无恶意哥们儿）,5月28日 20:25,(0)
我怀里有个十香,第二部就退坑了。现在这游戏，是真的💩,5月28日 12:57,(1)
光明听歌ing,别崩了，哥，现在崩3都快被骂死了，第二部做的跟屎似的,5月28日 12:54,(1)
梦玖云捏嘿嘿,哥们，你觉得你现在来岁月史书我有意义吗？你不能当我不知道吧,5月28日 09:08,(1)
梅花有山,我也是,5月26日 20:56,(0)
anying_awa,还记得在海嘉德07服务器里以前和一个人搞星岛绘图师时的开心，退游那么久回游后看着100级的大佬，我无语了,5月24日 20:00,(2)
Kaodii,这个真爱听,5月22日 14:23,(0)
见识见识计算机三级计算机,克拉瑞尔可以说是剧情里我最喜欢的一个了，无论是主线还是支线都挺有温度的。,5月19日 11:15,(2)
贤贤-抱抱芙芙版,差不多得了😄游戏官方和宣发渠道商是两个概念,5月16日 22:40,(0)
蓑蛾,退坑一年，仍然记得白鲸岛响起这首歌的感动,5月13日 16:49,(2)
果果一生堆,一首忘不掉的歌曲，时隔两年已经回坑回溯服,5月9日 00:06,(3)
李李i彤彤,格网赛高哒！,5月7日 22:25,(2)
周二珂珂珂珂呀,我海嘉德1区的， 以前那会真的很热闹，公屏聊天助力,5月6日 20:48,(2)
TOSAKA凛_,幻塔只会拐原神，不拐没流量，最后反咬一口更会引来许多人，不然幻塔没人玩🥹,5月5日 20:01,(0)
卷毛的lion,关服进行曲（）,5月5日 19:59,(0)
花拾月,最怀念艾莉丝不破咲伊卡洛斯那一段时间,5月5日 10:04,(2)
杨真小,星岛1区，还在苦苦坚持。,5月3日 13:29,(1)
周二珂珂珂珂呀,[多多耍酷],4月30日 23:03,(0)
周二珂珂珂珂呀,你们都是哪个区的,4月30日 23:03,(0)
割_裂,同样快一年了,4月30日 16:00,(1)
可惜你我无缘,在我心里一直都对得起,4月29日 23:40,(1)
梦与夜樱星夜之雪,我也是啊！退了两年了，但是还是忍不住回来看看,4月28日 16:41,(2)
周二珂珂珂珂呀,退坑快1年了， 陪伴了我无数个日日夜夜，也结识了很多朋友，虽然不玩了，但偶尔还是会回来听下[多多难过],4月27日 21:58,(5)
-Augur,说实话在白鲸岛听到这个歌还真的感动了。,4月21日 19:36,(3)
大大的可爱的蜗牛,幻塔虽然玩的体验感不咋地，但歌曲是真的不错（满命白老板护体）,4月19日 02:14,(0)
绯丝Fffffffaith,我永远热爱幻塔，祝幻塔越来越好，蒸蒸日上,4月14日 22:52,(0)
狂奔中的陆战力,听歌歌都能看见吵架，建议你们线下约架打完该干嘛干嘛，记得直播。,4月14日 21:35,(0)
凉邪君,跑来幻塔的歌里拉踩，果然藕片死性不改,4月11日 14:54,(0)
op是这样的,原来是米笑子，难怪会着急,4月11日 14:53,(1)
梦毅网络,喵喵喵喵喵喵喵喵喵喵喵[多多耍酷][多多耍酷][多多耍酷],4月9日 15:10,(0)
TOSAKA凛_,你自己颠倒黑白还说别人？真牛逼果然幻批真能洗地。,4月7日 21:46,(0)
桐欢toua,不带你跌是不是不会发评论，好好评论歌本身不行吗,4月5日 12:50,(1)
梦伊始-珞月,一向支持塔塔，剧情还好，虽然烂还刀，但重要的不是剧情,4月4日 20:35,(0)
Zero_yax,在2024年的今天，从刚开始的亚夏到现在的九域，一步步走到今天，幻塔真的可以说为肉眼可见的变化和进步，希望4.0可以再一次惊艳众人，祝幻塔越来越好。,4月4日 05:32,(4)
山东大哥VC,22年11月份疫情期间经常玩，现在不玩了,4月4日 02:22,(0)
夕阳不为月落,我真的好喜欢这首歌 之前那些通宵玩游戏的朋友 时常为了一个任务一跑图就是一晚上 可惜现在都已经不在啦,4月4日 00:25,(1)
杀生者刀也,上一个开怀旧服的还是几十年的老游戏真是弯道超车啊，但是它自己滚了呢,4月2日 20:46,(1)
狂奔中的陆战力,你去岛上听听看看搭不搭。,3月29日 23:02,(1)
如残阳般燃烧,想起第一次在空岛的夜色中，站在房顶上，看着一簇簇烟花，耳旁回荡起meant to be 空灵而又略显孤寂的旋律，回忆着旅程中遇到的人与事，那个每天活泼快乐叫莉莎的女孩是我历经重重困难也想追寻回来的，即使前路艰难，但也依然还有希望。,3月21日 22:13,(7)
程DdDddddd,开服那会啊，，开服那会一两个月和大家一起玩的,3月20日 08:12,(0)
losthemusic,有个游戏歌特好听，就是幻塔,3月16日 13:59,(2)
狂奔中的陆战力,一个月能玩出什么来嘛。。。。,3月9日 09:01,(0)
2233QWQ2233,真的是啥都好，除了剧情细节透着经费不足，最难受的就是塔塔在数值的道路上一路狂奔，明明这么多武器，不去做武器功能多样化而是选择数值多样化，让过去的武器都变成废铁，简直无法想象，多么好的游戏啊，太心痛了,2月28日 10:33,(4)
2233QWQ2233,为什么幻塔的武器多样化不是真正的玩法多样化而是数值多样化啊，太恨铁不成钢了，那么多武器，明明功能性都挺强，非得用数值把他们变成废铁，知道看到有多心痛吗,2月28日 10:25,(0)
铃萌可可,不知道还有没有人记得白鲸岛,2月26日 15:28,(2)
whitedango,虽然退坑一段时间了，但这首歌一直很爱,2月24日 01:25,(0)
最耀眼的星尘,加油哦，我也是今年考研,2月23日 14:46,(0)
宸歆Actdoll,我玩幻塔不是因为她是个多么好的游戏，而是因为幻塔总是更给我养娃的成就感和挫败感，幻塔比起游戏本身更像一个不断成长与在成长中受挫的小孩子。我希望有一天我能自豪的跟朋友说，我是幻塔玩家。,2月23日 00:33,(6)
沐梏-,我命中注定是研究生！,2月22日 20:32,(2)
Poros-1,现在对得起,2月22日 14:21,(0)
冬--冷凝,幻塔跟原神除了开放世界外已经没什么关联了。一开始被对标原神的要求束缚了手脚，到镜都才发挥出自己的长处,2月16日 11:48,(0)
吾之所悥,想退坑的时候回来听一下就治愈了，因为每次听起这首歌我都会想起在星岛的日子,2月12日 00:23,(6)
你是我的小宇宙1314,有谁最喜欢无序深渊的吗,2月7日 19:35,(1)
你是我的小宇宙1314,我最喜欢无序深渊,2月7日 19:35,(1)
WEAXM,卡不了一点，你卡可以换手机🤣👉🤡,1月30日 19:48,(0)
留我在阳城,米娅，对不起，我没有好好陪你,1月30日 01:41,(8)
Slilu_,幻塔唯一不会被喷的就是这首Meant to be,1月27日 09:31,(48)
金木研or琲世,我是原，也玩塔，我只能说这俩除了都有大世界属性就没啥太一样的了，幻塔到现在也算不错了，在手机上的开放世界游戏里只能说在原之下(抛开优化)，攻击的OP我只能说纯魔怔哥(怀疑跟百万塞尔达一样是TX水军,1月22日 21:30,(1)
一只五岁的小阿凉,两个游戏走的不是一条路线,1月21日 22:02,(0)
一只五岁的小阿凉,的确没什么可比的,1月21日 22:02,(0)
一只五岁的小阿凉,我感觉塔塔好好再优化一下真的有超过原神的希望,1月21日 22:00,(0)
一只五岁的小阿凉,两个游戏各有各的优点 我是从米哈游的游戏来的 后来才开始接触其他二次元游戏 客观角度来说 原神美工好 音乐好 特效动作好 但是剧情不如崩三 玩法不如其他的大世界游戏 所以后来退游了来幻塔 幻塔的剧情音乐和最近的角色设计都很吸引我 就是优化和整体流畅度比较差,1月21日 22:00,(1)
一只五岁的小阿凉,没有联机的快乐 不能一起开宝箱的话大世界真的就没有意义了,1月21日 21:57,(0)
一只五岁的小阿凉,这样的低等优化程度能让我一直坚持玩下来也是因为它本身的机制 有一说一 幻塔的整体设计风格不如原神 但是捏脸玩法以及其他的地方真的比原神强 单机开放世界我是真的无法接受,1月21日 21:57,(0)
一只五岁的小阿凉,为此向你的这条言论致敬 现在网络上很少有你这种人了 真的很敬佩 具体的说不好 不过大家应该都能理解我吧,1月21日 21:53,(0)
一只五岁的小阿凉,真的了，除了优化不好其他的都很愉快,1月21日 21:49,(0)
别看了玩儿幻塔玩儿的,对得起,1月20日 18:04,(1)
小忽悠就是在下,快两年了 一听到还能想到鲸鱼岛上看烟花 天呢这首歌太棒了,1月20日 00:15,(1)
万古流萤,二四年了，我和幻塔唯一的关系只剩下这首歌了。,1月18日 21:04,(0)
遇水变答辩高,这游戏国际服是腾讯运营的，比国服强,1月13日 21:57,(0)
温迪绯闻女友,幻塔和原神没什么好比的，各有各的好，比下去只会引战,1月13日 19:06,(14)
封心阳少,白鲸岛么么叽,1月12日 00:40,(1)
幻塔下的宿命,对不起，我没有做,1月11日 00:09,(1)
幻塔下的宿命,2021 11 06 2613 艾达星,1月11日 00:07,(1)
嘉人们然起来了,令人感叹,1月9日 12:15,(1)
嘉人们然起来了,幻塔！启动！,1月9日 11:24,(0)
塞拉菲姆-,因为爱可以跨越永恒,1月6日 10:04,(3)
余生路坎坷,公屏问，几乎任何时间都有人回答,1月5日 04:17,(0)
扶桑_落雨-komorebi,2周年的塔塔配的上这首歌！,1月4日 21:44,(1)
鹤然然_HCV0,塔塔，不要让我再歪了好不好,1月4日 11:34,(0)
松永燕Matsunaga,笑死我了，你不会不知道最多连续歪两次吧,1月2日 20:47,(2)
书房中独卧,2024新年快乐,1月1日 00:01,(5)
我是孫策的修狗,我的年度歌曲,2023年12月30日,(2)
powkms,玩了一年多啦,2023年12月28日,(0)
黎与亲,这首歌越听越感动 想回游，但回游只有打不完的副本 升不完的装备 以及无穷无尽的数值 真正的塔塔其实已经死在亚夏了,2023年12月26日,(0)
黎与亲,从九域开始就不玩了，现在剧情怎么样了,2023年12月26日,(0)
黎与亲,维拉退游的，茵纳斯回游的，九域出了又退游了，现在回游还来得及吗[多多捂脸],2023年12月26日,(0)
紫小弦zx,开服的元老了，中间退了一段时间，没见到塔塔变化最大的时期，有些可惜。2.5回坑的，一开始最让我震惊的是镜都，扩大了一大圈，然后是海洋，效果比我预期的还要好，到后来的九域，每一处都能给我惊喜，一路的等待与陪伴，希望塔塔越做越好,2023年12月26日,(2)
诗--云,《春晚看海灯节》,2023年12月22日,(0)
crims_on,手机里有一款周年庆版本女主跟执行者告白的游戏,2023年12月21日,(23)
Takagi_freesia,我的心还在白鲸岛上,2023年12月21日,(4)
我爱学习学习使我快乐-666,现在女仆的四叶十字已经常驻了,2023年12月21日,(0)
我爱学习学习使我快乐-666,虽然，但是……🐶塔，2周年快乐,2023年12月21日,(1)
昵称不可以为空13451,我的年度歌手：幻塔手游,2023年12月20日,(1)
沐梏-,年度报告第一[多多大笑],2023年12月20日,(1)
A5ans,塔塔祝你生日快乐,2023年12月20日,(1)
Stars_1fff,🧡🧡🧡❤️❤️❤️,2023年12月18日,(0)
叫我岚岚吧,玩了会退坑了，其实挺想玩下去，但这类游戏没怎么玩过加上教程问题周围也没人玩，我根本不知道要干嘛，意识要抽，装备我是有次刷视频才知道要刷但不知道哪刷，最后就退坑了听到这歌莫名感触，想回来了。,2023年12月18日,(1)
夏夜星空海,让莎莉和执行者都活了下来，自己机械飞升和执行者再度相见，执行者记忆恢复，和奈美西斯莎莉三个人一起过上了幸福的生活，BGM《meant to be》指的就是奈美西斯和执行者命中注定会再次相遇,2023年12月18日,(0)
夏夜星空海,等编剧给你来个大的，meant to be的意思其实就是执行者和奈美西斯，奈美西斯和执行者很早就认识，由于种种原因，奈美西斯意识体陷入沉睡，后来被贤者放到了莎莉身体里，执行者与莎莉的相遇是贤者一手安排的，目的就是唤醒奈美西斯，奈美西斯知道后也有了自己的计划，最终排除所有威胁,2023年12月18日,(0)
_Layout,以前刚出幻塔的时候挤爆服务器，进去就是探索开宝箱。那时候世界公频召集队伍打花，我还在一直探索星岛现在只剩回忆了🤧,2023年12月17日,(0)
宣様,2岁啦,2023年12月17日,(0)
静邂陷雨,2周年了[多多大笑],2023年12月16日,(3)
魔法少女仙桃樱,电脑版的幻塔贼好玩,2023年12月16日,(0)
西普伊恩斯,二周年了，好怀念当时大清早挤开服听这歌的日子😭,2023年12月16日,(5)
水元隼也,狗塔生日快乐一路见证你的成长,2023年12月16日,(9)
对梦想的追逐,"And my love won’t die.
一往情深，生生不已
“For” and “ever” is you and I.
只因我与你终将永不分离",2023年12月16日,(2)
对梦想的追逐,神曲,2023年12月15日,(0)
看到记得喊我打卡谢谢,回顾,2023年12月14日,(1)
蜜甜柑桔,对对，开服那时候听到就觉得一股尼尔味，还在幻想能不能联动,2023年12月14日,(1)
田猿狙士,这不是玩家自己要求的开局进镜都吗,2023年12月10日,(0)
Set-Fire-to-The-Rain-,第一次去白鲸岛，做完任务出来，毫无征兆的漫天放起烟火，配上这首曲子，就真的很暖，很惊艳,2023年12月10日,(7)
麟个,等你回溯,2023年12月8日,(1)
神经是不是,呜呜呜好久没玩了 想念[多多难过][多多难过],2023年12月8日,(0)
神经是不是,中立！各位别吵了！！,2023年12月8日,(1)
绯樱馋猫,小红心❤️,2023年12月8日,(0)
渊星midnight,完美最完美的游戏就是塔，至少九域之前，对玩家感受的捕捉很强：和路人打打闹闹、组队爬幻塔、海嘉德翻垃圾箱、公屏黑奴疯带新手，在废墟里，在巴别塔下的废土里。现在运营变笨，美术变恶，策划变呆，当初被喷爆，照样进步，一步一步惊艳玩家。他给我的快乐是真实的，独特的,2023年12月6日,(0)
Tsuki也要做动画,2个多月没玩了,2023年12月6日,(1)
不科学人生,这首歌让我从开服玩到现在,2023年12月5日,(3)
catsunsky,没在幻塔顶上听过这首歌塔生也是失败的,2023年12月4日,(1)
jackyuanchen,插眼，赶巧了就来看看烟花,2023年12月4日,(1)
赐我痛一场,亚夏就完结了,2023年11月30日,(1)
江残世,听着这首歌总感觉幻塔其实已完结了,2023年11月29日,(2)
银牙不是熊猫,byd幻塔你能不能再支棱起来啊，为什么变成现在这样子了啊啊啊？！,2023年11月28日,(1)
离离离离离离离离离Li,幻塔的剧情删了好几段 新手任务结束 莎莉就已经变成了奈美西斯 幻塔 这就是你设计的主线剧情吗,2023年11月27日,(1)
离离离离离离离离离Li,幻塔顶还有流星哦,2023年11月27日,(0)
离离离离离离离离离Li,我听见这首歌我脑子里在想一个旋律 怎么都想不起来是哪里的 想 什么曲子大结局很震撼来着 想着想着才想到尼尔机械纪元 虽然我没玩过,2023年11月27日,(0)
松永燕Matsunaga,真的很想再和朋友们好好地玩幻塔打boss，希望重塑后能在社交和完善地图上好好下下功夫，镜都没做完真的太可惜了,2023年11月26日,(1)
星期日忠犬,2023.11.25幻塔对得起这首歌,2023年11月25日,(40)
Phanstom,2023.11.24，填完了塔子发的问卷。珍惜希望塔塔能在4.0重塑自我，涅槃重生🥺听到这首歌真的怀念开服那段时间，现在塔塔带给我的只有无尽的数值压力。。。,2023年11月24日,(3)
丹良薄命,太痛了,2023年11月23日,(0)
要叫篁大人,,2023年11月22日,(0)
我是孫策的修狗,有一说一这首歌太神了，过年的时候在白鲸岛做任务听到这个背景音乐，真的超级惊艳，后来海底出来就没玩了，受不了数值膨胀，现在也就听听音乐回忆一下过去🥺,2023年11月19日,(13)
EK梧声,"“哥哥！”
“莎莉！”
……
“明景先生。”
“莎莉小姐。”",2023年11月18日,(3)
NXV-59-V,别乱升世界等级就行。,2023年11月18日,(1)
南部花仔,去年一开服就热衷于每天玩，世界观，唯美的画面，未来失落的世界，我很喜欢，但是bug多，游戏的商业模式设计的有问题，导致玩家流失严重。,2023年11月13日,(1)
蜂蜜柠檬巴斯克,这首可以封神了，虽然我不玩这个游戏，我是尼尔玩家,2023年11月12日,(6)
AI_forever,俺也一样,2023年11月11日,(2)
EK梧声,真的，心疼莎丽受着多大的苦到处和执行者乱跑找老哥，好不容易找着了结果只能以“莎莉小姐”的身份默默陪在自己哥哥身边（提一嘴，新剧情夏佐救妹真的帅）,2023年11月10日,(0)
薛定谔狗,你说的都对[多多比耶],2023年11月9日,(0)
英俊不凡的九,我也是,2023年11月6日,(0)
灰尘1045,莎莉真的是你游塑造最最最成功的角色了，唯一一个让我忍不住心疼的女孩,2023年11月4日,(34)
蒼咲雫,第一次上白鲸岛一听钟情,2023年11月3日,(1)
枫晓叶aibat,圈外人，听到这首歌真的很震撼，给我的感觉像是相遇也像离别，更像是一种约定，与奇迹的约定,2023年11月2日,(3)
阿梅lll,一年多没玩了，估计我的月卡还没过期🤣🤣🤣,2023年10月31日,(3)
今天下午会偶遇爱莉希雅吗,让自己女儿跳兔女郎啊。,2023年10月29日,(2)
啾咪的阿网,很感触，如果不是一开始玩的坚毅也许我会继续下去！,2023年10月27日,(0)
云村村民161338228722967,低于18级才会被删档，你得反思下你为什么没有18级,2023年10月23日,(1)
紅魔館丿主,很感触，如果我不是玩的火的话，也许我还在玩吧,2023年10月22日,(1)
Mr-五条喵,打完白鲸岛主线任务准备走，突然背后响起了这首BGM，伴着烟花绽放，人突然就愣住了[求你了],2023年10月21日,(28)
贝贝的开心皮皮,我,2023年10月14日,(5)
NmVz,整多个次元时空世界对我来说并不是啥延续故事的好方法，现在幻塔唯一让我有玩下去的动力就是执行者过往的记忆和mia，除了这两个我在幻塔没有任何感兴趣的东西,2023年10月13日,(3)
风上之音,玩原神导致的,2023年10月11日,(1)
蘑菇酱超好次,op-互联网膏药[蛋仔吃瓜],2023年10月10日,(1)
歆歆来了哦,抽卡歪了只能怪你运气不好啊这你还能怪谁，本来就百分之五十的概率要怪就怪自己非酋呗,2023年10月7日,(0)
MEGALOVANIA2008,虽然炸服，但是“我就是因为把你们当人看”这可真是说到做到,2023年10月3日,(0)
