username,comment,comment_time,like_counts
枫叶-qwq,幻塔的卖点是开放世界吗？,2022年9月14日,(0)
枫叶-qwq,如果你加这么多限定条件的话，那确实是没有了,2022年9月14日,(0)
放逐的白狼,而且你也没有明白我在说什么，我说游戏了么？我有否定游戏的功绩了么？我在批判你们这群玩家，恶意挑起战争，每次线下活动总有些玩家出来丢人现眼，我在批判这些人，而你却自以为是的一概而论，歪曲我的意思，你的所作所为和原神小黑子一个鸟样,2022年9月14日,(0)
彡笙丶歌丿,对对对，原神热度都是赞助拉来的我给你一次重新组织语音的机会，你再好好想想原神热度怎么来的，笑死我了,2022年9月14日,(0)
小竹子的秘密花园,"我问你，现如今除了米哈游的原神和库洛即将到来的鸣潮，国内还有哪款开放世界游戏比得过幻塔，现在的2.2已经可以称得上优秀水平了。
虽然优化确实烂。",2022年9月14日,(0)
小竹子的秘密花园,他也没发癫啊，确实如此啊，你多玩玩二游就明白了。,2022年9月14日,(0)
江湖传说190118,1.0时代为数不多的亮点之一,2022年9月13日,(1)
不识门外音,好好一个歌，被倭叩破坏了氛围,2022年9月13日,(13)
千里苍山暮,哥们，2.2版本了解一下,2022年9月13日,(0)
三七-XXl,鸣潮出了？,2022年9月13日,(0)
轩辕慕容东方独孤妹,有空回老家看看,2022年9月13日,(0)
轩辕慕容东方独孤妹,慢慢来吧[多多比耶],2022年9月13日,(1)
野蛮朵拉,应该是纯纯的拱火人，引战招黑看乐子，两边都不站，无论幻塔还是鸣潮评论区弹幕一直引战到现在（甚至还有抓到几个承认是乐子人的）甚至还包括国外大厂的3a大作也不放过😅或者是真素质低,2022年9月13日,(0)
野蛮朵拉,应该是纯纯的拱火人，引战招黑看乐子，两边都不站，无论幻塔还是鸣潮评论区弹幕一直引战到现在（甚至还有抓到几个承认是乐子人的），甚至还包括国外大厂的3a大作也不放过😅或者是真素质低,2022年9月13日,(1)
缘小聆,原神吸引火力，幻塔默默发育,2022年9月12日,(9)
徒道清悠233,话说sr应该抽出7次就行了吧，不用给他真正升到满星,2022年9月12日,(0)
嘉兴第一深情-,在白鲸岛放烟花的时候听到这首歌真的很感动,2022年9月11日,(0)
宣寂妄想,这是网易云，发癫去贴吧b站,2022年9月11日,(1)
等待着170922,开放世界去指要好的探索体验还要去抽特定的角色吗？（温迪，钟离，叶兰，万叶，凌华）。是指跑两步，爬下山就没体力，设定都是战力比普通人不知道高多少神之眼拥有者吗？,2022年9月11日,(0)
等待着170922,去偷你盘子吧，这里没有盘子,2022年9月11日,(0)
arisa2023,当初那个淘气包莎莉早就在人生变故当中湮灭了。人生无常，令人唏嘘！,2022年9月11日,(1)
该用户名以存在000,其实我觉得玩家都是棋子，游戏公司才是操盘手,2022年9月10日,(2)
卑微小源在线y_x,不对标任何游戏，幻塔真的对得起自己家的玩家，在慢慢变好,2022年9月10日,(2)
flossy未晞,塔塔开服时那么多买的评论难道也是百万阴兵？,2022年9月10日,(0)
flossy未晞,某游官方下场讽刺其它游戏了吗？,2022年9月10日,(0)
flossy未晞,…自己能不能去查查看，b站挺多的吧,2022年9月10日,(1)
flossy未晞,？没拉踩啊，说真的你们没看过那篇官方内涵的视频吗？,2022年9月10日,(0)
厕所里的圣女画像,对得起了,2022年9月10日,(0)
白上小姐的猫,○u真是爆笑如雷，从二次元手游圈到单机游戏圈都瞧不起你，还要据理力争岁月史书。,2022年9月10日,(13)
36K_Black,问题你再往前看没几天就有来搞事的……只能说敌意不是白来的,2022年9月9日,(0)
放逐的白狼,要不是原神收入不错，可以用钱拉赞助，说实话，照这么下去，必胜客，肯德基等一众快餐行业都不想接这个单子了。每年都有，上次一个桶抄到几千块钱，还他妈有傻子买了.....说实话，我没见过哪款游戏玩家（个体）会没有脑子到这种程度,2022年9月9日,(1)
放逐的白狼,原神为什么绯闻不断，还不是你们这种玩家的存在吗？最近的必胜客联动竟然都说出了要不是原神没人认识必胜客，还有当街跪拜原石cos，喊这名cos为爹的，视频随便搜搜关键词就有，里面的跪拜磕头可是比跪父母还要真，有这种玩家的存在，路人缘早被败坏的差不多了,2022年9月9日,(2)
白猫小哈,你米跌给你多少钱到歌来ky 有千镜米哥多么😂,2022年9月9日,(0)
tkmy_Yukiko,你这话的逻辑是粉丝多活该被网暴？🤣原友的脑回路属实有点离奇了,2022年9月9日,(0)
tkmy_Yukiko,🤣好好好，还得是岁月史书好用,2022年9月8日,(0)
T悠T,有没有一种可能20年6月幻塔的pv就被倭叩团建了？有没有一种可能，次元研究是21年7月出的视频？,2022年9月8日,(14)
再无可许下的誓言,这歌配烟花真是绝了,2022年9月8日,(5)
该用户名以存在000,我觉得有点虚空索敌，音乐区谁特意过来吵架,2022年9月7日,(0)
斑马座幻想,虽然奈美就是莎莉，2.0之后也一直跟玩家在一起。但是，奈美再也没像莎莉那样的笑过了。这关系就很微妙，现实中也会有这种，两个人都不说，但是都知道有些东西已经变了。,2022年9月7日,(18)
nevartelys,这首歌也太好听了吧？？？？？？,2022年9月7日,(1)
楪舞願,不是后面才好玩吗,2022年9月7日,(1)
枫叶-qwq,笑死了，幻遢是这样的,2022年9月7日,(1)
枫叶-qwq,崩二碰瓷tx？你这消息怕不是贴吧来的,2022年9月7日,(1)
枫叶-qwq,然而并没有。。。,2022年9月7日,(0)
AbsoluteCao,凡是要讲证据，拉踩游戏的证据呢？,2022年9月6日,(4)
AbsoluteCao,对得起,2022年9月6日,(0)
AbsoluteCao,神曲打卡,2022年9月6日,(2)
処愔,这首歌搭配烟花绝对值得你为此停留,2022年9月6日,(6)
黄花菜XD,这首歌是不是讲克莱尔和卢恩博士的(；д；),2022年9月5日,(1)
古染付樱川平水指,《更好》,2022年9月4日,(0)
梅娅_kong,明天2.2测试服就开了，后天测试服就要开完整镜都了！各位一样有测试服资格的朋友们，大家一起马克拟态女厕所走起！,2022年9月3日,(3)
梅娅_kong,看着这楼主脸被打的吱吱作响我就觉得乐呵,2022年9月3日,(0)
响_转,幻塔牛逼,2022年9月3日,(0)
你说笑那你说,他说PO你沉默啥啊，正常的原神玩家又不是OP。,2022年9月2日,(1)
摸圣秦川,喜欢一下台地就能全地图跑的旷野之息吗😂,2022年9月1日,(0)
摸圣秦川,开放世界和游戏性而言O比旷野之息简直云泥之别很喜欢O的一句话:前方的区域以后再来探索吧😂笑死,2022年9月1日,(1)
摸圣秦川,要不谈谈为什么O出来的时候PV碰瓷塞尔达旷野之息？做人别太双标你米叠都承认抄了同行的东西,2022年9月1日,(1)
叉刀口口,加油,2022年8月31日,(1)
君勿半途而废,你现在装的每一秒s都是为以后买不着⚰本做铺垫,2022年8月31日,(2)
浔枵,支持支持，多坑玩家真的烦死了……,2022年8月31日,(0)
练气无止境,毕竟能说出，抄袭，借鉴，这种双标话的叩有啥好说的。没有人会在音乐区追着讲这些，除了叩😩,2022年8月30日,(0)
练气无止境,又只会是笑死，叩不会说话吗。6啊，自己回复的，说你一句，就撇清关系了。还你家，公司我开的吗？我看叩不爽，不能骂是吧?还魔怔，没你叩魔怔跑到这来√叫，太会快速切割😋,2022年8月30日,(0)
练气无止境,就喜欢你去当网络jc认真找证据当小丑逗大伙开心😁，然后实际上屁用没有😂和你好好讲话就会像上面老哥一样，还不如直接见叩骂一顿，我也开心哈哈。,2022年8月29日,(1)
练气无止境,请你不要到处叩叩🤗,2022年8月29日,(0)
练气无止境,我天天薄纱，我好急😫，急死我了😆😆，求求你别说了😫。叩为了打脸我，连疑似都拿上台。叩的神经都是这么敏感么？😋,2022年8月29日,(0)
练气无止境,我不会见人就骂，但见叩就骂。,2022年8月29日,(0)
练气无止境,讨论你没有游戏区吗，来音乐区讨论，这点屁大点事，就值得在这里的√叫，叩是没有自己家吗？,2022年8月29日,(0)
练气无止境,原神借鉴塞尔达，幻塔抄袭崩三，双标属实给你玩明白了🤗🤗🤗对对对的dinner😆，啊错错错咯,2022年8月28日,(0)
练气无止境,玩个游戏就你柠檬事多，op414。没见过这么🗡️的。,2022年8月28日,(0)
练气无止境,我玩啥是我的事，ky的op就欠骂。,2022年8月28日,(0)
练气无止境,搞笑哥，来这秀游戏优越感，谁把你当回事，跑别的游戏团建，就只有op了。谁管你吃啥瓜，在这里硬装柠檬优越呢。,2022年8月28日,(0)
练气无止境,狗叫哥，自己跑来评论区团建你的优越感，叫了那么多声，然后被薄纱啊对对对。气急败坏😤,2022年8月28日,(0)
怪妳過分美麗Y,2020 纳尼,2022年8月28日,(0)
练气无止境,哭死，比玩家还关心幻塔。,2022年8月28日,(1)
练气无止境,除了塞尔达，别的游戏都像原神🤔,2022年8月28日,(1)
练气无止境,你打字也是抄部分新华字典的，建议学仓颉造字。打那么多我看都觉得累。,2022年8月28日,(0)
练气无止境,你是在搞笑吗？每一点强行解释，yy能力太强了。还梗，dinner梗小鬼是吧。,2022年8月28日,(0)
瑾月kt,比丁真还纯,2022年8月28日,(0)
缪奈,做完雪原主线 在白鲸岛上偶然听到这首歌加上烟花 让我想起了ff13 有一丝感动,2022年8月28日,(3)
Akfupup,开放性不敢苟同，原神更倾向玩家走他设置的机关去爬山或者解密，而幻塔这么有更高的自由度，开放性我觉得幻塔这边更胜一筹,2022年8月28日,(1)
Akfupup,对标和下个tga是个加速器擅自发的广告，官方从有过这意思，而且幻塔18年立项，对个从未谋面的猿是吧。还有原批真的是妈妈撕了，你现在去看2.2pv下有多少原批搁那恶心人，验证楼主这句话,2022年8月28日,(29)
魅魔少女椰鱼鱼,顶顶！,2022年8月27日,(0)
漂浮银河系,浓度真的是太纯了，哪个正常原神会这么高强度巡逻，所以说你只可能是OP,2022年8月27日,(2)
彡笙丶歌丿,你是什么出生东西？,2022年8月26日,(0)
James家的小可爱,高强度巡逻op,2022年8月26日,(0)
6kljh,还在坚持.....待续......,2022年8月26日,(3)
moronw,巡逻到歌里面来了都，是你们自己的歌不好听我懂的,2022年8月25日,(3)
第五血型,如果亚夏有必去的地方，那想必是游戏内时间22：00的白鲸岛了,2022年8月25日,(6)
窝窝崽崽,我再说的是内个人喔,2022年8月25日,(0)
幻夜坠月,欧泡来了啊,2022年8月25日,(0)
练气无止境,装什么理中客，别人解释了，还在那硬黑蹭，你是选择性失明吗，你要不要看看幻塔第一条pv弹幕哪个游戏玩家在团建🙂,2022年8月24日,(1)
练气无止境,你能找出一条官方蹭原神的吗?,2022年8月24日,(0)
祥阿祥阿,希望更多的友友可以听到这首歌，幻塔真的是一款很感人的游戏，希望可以在那个世界碰到你,2022年8月24日,(3)
沉于幕,原神玩来玩去感觉就那样，玩久了真的没意思,2022年8月24日,(1)
御坂19632号,还是看看远处的次元研究吧家人们,2022年8月24日,(0)
混元形意太极第三代掌门人马保国,也就会呵呵了是吧你完美爹最近请的水军不咋地啊,2022年8月24日,(0)
轲华立夏,原神经典冰清玉洁,2022年8月23日,(29)
仙月li,保底歪了,2022年8月23日,(0)
仙月li,我也好想爬然后抽个弗丽嘉,2022年8月23日,(0)
仙月li,搞得我也想爬了,2022年8月23日,(0)
不正经的魔王飞鸟真,你先别急啊，干嘛一说op自己就跳出来了？自己是不是op自己心里不会不清楚吧,2022年8月23日,(44)
该用户名以存在000,说实话塔塔在公关方面也不值得同情,2022年8月23日,(1)
认真取名的御坂10032,谢谢你没有说幻塔是腾讯的 属于是倭叩里智力较高的一批了,2022年8月23日,(2)
风海风海,稍微探索下等sr满星就是110发大保底，等普池ssr满星就是100发大保底,2022年8月23日,(0)
是芽衣呀-,原神是arpg哦，幻塔是mmorpg,2022年8月23日,(2)
流汗皇豆,迷你猿粥农塔战多厨狂嘻→嘻↑嘻→嘻→嘻↑嘻→嘻↑,2022年8月23日,(0)
辉煌wg,好,2022年8月23日,(0)
名字还没想好_DVwE,"我超,原!",2022年8月22日,(7)
凉邪君,经典蹭热度。看来你平时没少看那些节奏up的视频。我也没啥好说的了,2022年8月22日,(0)
该用户名以存在000,乐子人吧,2022年8月22日,(0)
鲜花快递vmndf,典中典,2022年8月22日,(0)
忽然雪落满一生,记得22点在白鲸岛看着烟花听着歌,2022年8月22日,(1)
9最强9,隔壁我也有玩，作为一位正常的玩家，我很讨厌那些只会到处KY惹事刷存在感的OP，好好的气氛搞到乌烟瘴气,2022年8月22日,(1)
该用户名以存在000,。。双厨沉默,2022年8月22日,(0)
We丶Never,有o的地方就有战斗，塔塔开，一自摸塔塔开,2022年8月22日,(3)
旅人空和他的老婆魈大人,😭😭真的很爱幻塔 期待2.3版本,2022年8月22日,(6)
VelexHW,国际服开服就免费开源外挂搞主播，身份证谣言还传出去了，是谁干的我姑且不知道,2022年8月22日,(19)
VelexHW,你米爹登记成立公司不到一个月就造谣碰瓷BAT，你怎么不说呢？哦只要是你米爹不好的都是假的都不承认,2022年8月22日,(6)
嘤嘤山上嘤嘤怪,晦气,2022年8月22日,(0)
不一样的两片叶子,我超 叩,2022年8月22日,(0)
泽沢纱羽,"Till the end of the time,none of us will say goodbye。",2022年8月21日,(2)
悠久的假日,怎么哪都是op哦 晦气,2022年8月21日,(1)
悠久的假日,晦气,2022年8月21日,(3)
悠久的假日,晦气,2022年8月21日,(0)
格诺诺,我超，o,2022年8月21日,(3)
格诺诺,我已不复往日，早已超越自我,2022年8月21日,(1)
凉邪君,对标原神是第三方广告的锅，可不能扣到幻塔官方头上。不要看见节奏up说啥就信啥,2022年8月20日,(1)
酒杯和茶,幻塔出第一个pv就开始被团建了,2022年8月20日,(23)
梦洛凋零,原神冰清玉洁，全世界都在打压原神,2022年8月20日,(8)
活性红磷,外服开了，打脸不？,2022年8月20日,(38)
湛蓝长毛恶蘑,倭叩对号入座了,2022年8月20日,(34)
莪丶友谊天堂,怎么，原神还不止对标了塞尔达呢？,2022年8月19日,(4)
白兔憨憨,说实话幻塔这音乐也还行，但是这游戏我真的玩到后面就玩不下去了……,2022年8月19日,(1)
An-94_,把证据拿出来吧…2000万投资的小作坊游戏敢下场拉踩3亿投资来自二游顶部的游戏，哪个官方宣发能这么没脑子，至于某游官方在开服是有下场的，好像是在taptap上发了一篇公告信，你可以去搜搜看,2022年8月19日,(13)
这不逗号,可幻塔刚开始不就说对标原神吗？这很难不让人去对比两者,2022年8月19日,(1)
御坂19632号,玩家给官方提意见都不允许唤官和倭叩有的一拼啊,2022年8月18日,(0)
Aurora-fearless,正确的,2022年8月18日,(2)
老人说遇见是福,两个游戏我都玩过啊，一个单机一个多人在线联机，你把他们放在一起比你要想想是不是单机就已经输了？,2022年8月18日,(1)
MIDAHO丶子弥,我好友遇到a不出来的bug，可能看体质？哈哈哈哈我也不知道,2022年8月18日,(0)
Mky坤,一眼op,2022年8月18日,(5)
希斯兰达_洛伊柯德,建议你收收味。完美官方下的融媒体跟苏州幻塔什么关系？分公司关系都摸不清建议remake。以及这种内容你来这里发那你纯粹就是骨头剑。,2022年8月18日,(9)
kaneshino家族成员,前奏和used to be有点像这是可以说的吗,2022年8月18日,(1)
梦洛凋零,难道不是，探索机制全是限定机制，幻塔这边源器全是肝出来的，高下立判，幻塔那座一千多米的塔是可以爬上去的，你换成原神你爬的上去？,2022年8月18日,(6)
凛夜夜夜夜夜,崩坏二还碰瓷tx呢，那么原神也碰瓷tx了，还有脸天天喊tx打压,2022年8月18日,(9)
此账号因涉嫌违法行为现已注销,开服那一堆作死放其他游戏上一个就得死，你游连犯五六个活到现在，算生命力顽强的了。不过现在外服开了，应该没有之前那么大压力了,2022年8月18日,(0)
我是渣渣辉我在贪玩蓝月,所以你是op吗,2022年8月18日,(25)
KnightShoemach,不戳不戳,2022年8月18日,(1)
原批偷盘子,倭叩都追到歌下面来了，可以，这很倭叩,2022年8月17日,(1)
沉默是今晚的水龙,目前bug就遇到过凛夜闪避穿墙别的都没有过，画质没得说没见有马赛克过,2022年8月17日,(0)
臃散,大可不必,2022年8月17日,(1)
臃散,你说的都对,2022年8月17日,(0)
臃散,拜托🙏，两个游戏你都玩玩，单论开放世界的打造，幻塔真比原神差点，别脾气这么大，被社会毒打了？,2022年8月17日,(2)
老人说遇见是福,前面做这么多铺垫就是为了那最后一句原神更强，我只能说孝子真的逆天,2022年8月17日,(13)
无昵称_olg8,你差不多得了，幻塔和次元研究都是完美世界控制，但是他们互相是平行关系，不是上下级关系，幻塔控制不了也指使不了次元研究。你怎么不说崩坏三是原神小号？,2022年8月17日,(12)
秋月乃爱_YBVE,可真会双标，不知道谁天天到处拉屎被人人喊打,2022年8月17日,(15)
kano_day_,曲扬是幻塔特别请来做音乐的，背景音乐还有主题曲基本都是他写的,2022年8月17日,(0)
saakhd,人手一个啦,2022年8月17日,(1)
杀生者刀也,太经典了,2022年8月17日,(2)
杀生者刀也,你@错了,2022年8月17日,(1)
doggy001,3.为什么次元研究变成了幻塔小号，为什么崩坏兔女郎不是原神小号？,2022年8月17日,(20)
杀生者刀也,经典原神的锅，幻塔刚出就带原神节奏怎么不说了,2022年8月17日,(36)
杀生者刀也,幻塔官方旗下的号带原神节奏的时候怎么没见有人说？现在开始装死装无辜了？收收味,2022年8月17日,(5)
杀生者刀也,问题是刚开始幻塔开原神的团被锤了开始装无辜了？官方指示自己小号带节奏就这样忘了？,2022年8月17日,(0)
舝喚,2.1版本了，大佬还在吗,2022年8月17日,(0)
判若两人DS,以前我还天真的觉得米哈游好惨，现在回首再看，一切只不过是资本的运转罢了，你们这帮小丑替厂商攻城掠地，厂商之间联手赚钱笑看狗咬狗,2022年8月17日,(1)
判若两人DS,打压？呵呵，里面多少黑红的元素在我就不说了,2022年8月17日,(0)
xb816,看样子幻塔人设剧情上来了，开始拿开放世界对比了[多多捂脸],2022年8月17日,(1)
梦洛凋零,然而开放世界自由度的探索体验，幻塔爆杀原神😅,2022年8月17日,(18)
梦洛凋零,你说的这些怎么我一个都没有遇到过。。。。。,2022年8月17日,(1)
MIDAHO丶子弥,亲身试验，虽然不能说超越但是也不至于那么拉垮，虽然有bug挺多就是了，比如突然乱传送（走着走着自己传送），画面突然有很多马赛克，莫名其妙发光，也可以算是游戏特性但是其实玩法和原神不一样，对我来说是长草期的救赎，我身边玩原神的也玩幻塔，因为都长草了，这游戏除了bug我都觉得挺好的,2022年8月17日,(0)
天朝战略武器,白鲸岛挂机专用bgm,2022年8月17日,(1)
toweroffantasy,关注toweroffantasy吧获取第一手国际服情报,2022年8月17日,(4)
臃散,别啥啥都幻塔原神对比的，他们两唯一相似的就是一个开放世界RPG，但很明显幻塔更侧重于多人副本mmo，而原神更侧重于单机探索，细分类型不一样，不过综合来说，开放世界幻塔比原神逊色一点,2022年8月16日,(21)
-唯爱喜多川-,卧槽，预言家,2022年8月16日,(0)
厄丰,出了,2022年8月16日,(0)
厄丰,呵呵,2022年8月16日,(1)
夏去秋来cwk,在白鲸岛挂机着去做别的事情，突然有了烟花和音乐，久违的感动了，谢谢,2022年8月15日,(4)
AobNaruko,白鲸岛上看着烟花听着音乐，感触很深,2022年8月15日,(4)
宣续妄想,mzr,2022年8月15日,(0)
eeflower,一部游戏何尝不也是一部电视剧呢，而且是一部能自己当主角的电视剧，这样想的话，游戏有主题曲也是很正常的事情了,2022年8月15日,(1)
听歌用琼,幻塔顶端的bgm确实好听,2022年8月15日,(3)
听歌用琼,请问您看过所谓官方拉踩的原视频吗,2022年8月15日,(14)
醉与白,已经在不少地方见到你说这话了，不知道你是否有什么误解，游戏就不能请人唱歌做BGM了?什么奇葩逻辑，你说买的，那就找到购买的证据，不知道你想在这里证明什么,2022年8月15日,(0)
鷜鴐颽,随着烟花的绽放，音乐响起，感到震撼,2022年8月15日,(2)
梦洛凋零,国际服大火！祝幻塔能不忘初心，继续前进！,2022年8月14日,(1)
南国诗意,你叠嘛也是腾讯的,2022年8月14日,(0)
雾雨丶Adoreya,虽然没玩过，但是这首歌真的能让我起鸡皮疙瘩,2022年8月14日,(2)
keke_lite,已经出啦,2022年8月14日,(0)
常温笑话,每次听到这首歌都会想到白鲸岛的克拉瑞尔，她的支线真的好配这首歌，幻塔加油啊,2022年8月14日,(8)
Sincerelyi,昨天刚出的,2022年8月12日,(0)
linchangyi,已经超越了，我是未来人特来告知。,2022年8月12日,(0)
flossy未晞,首先，表明一下我双游玩家，因为在游戏里听到这首歌找过来的。其次，我记得当时是幻塔官方先下场拉踩某游戏的吧，否则我不会过几个月才入坑。最后，提醒一下，某游戏开服节奏那么多的时候官方也没下场,2022年8月12日,(7)
cocczh,不是游戏里的背景音乐喔，是主题曲那种。我之前以为只有电视剧才有片头曲片尾曲,2022年8月12日,(1)
lllalala2,我俩都玩，说实话幻塔差远了,2022年8月11日,(0)
alva大王,第一次登上白鲸岛，找了半天黑核和供给箱跑的很累，无聊坐在旋转木马发呆，突然这首歌响起，抬头是漫天烟花。真的是非常感动呀,2022年8月11日,(13)
AAA麻辣烫批发梁姐,第一次放内个烟花的时候真的很感动呜呜呜呜呜,2022年8月10日,(1)
徒道清悠233,说白了就是抽120次就可以免费获得这个奖池的角色,2022年8月10日,(0)
彡笙丶歌丿,不明觉厉,2022年8月8日,(0)
Yelena-my-Love,那其实这些也不是骂人doge为何就这样放弃治疗，小伙伴别老是晒你那已经干死了的脑细胞#不带脏话骂人# 如果你是一朵花、那牛都不拉粪了跳蚤可以在你头发里面度过春夏秋冬看，这不就可以让人来ETC了吗？#还是成为了自己讨厌的自己# （指自己）,2022年8月8日,(1)
Yelena-my-Love,这不就明显的指桑骂槐吗？,2022年8月8日,(0)
彡笙丶歌丿,我也没骂你啊，也没看懂你回我的是啥意思,2022年8月8日,(0)
-唯爱喜多川-,这首歌我从两位数评论听到现在的999+评论，塔塔的游戏质量也在这点时间里有了很大提升，还是很感慨的。幻塔我大概率会一直玩下去的，只求策划做个人，别让这游戏凉了。[西西再见],2022年8月8日,(3)
-唯爱喜多川-,乐,2022年8月8日,(2)
Yelena-my-Love,想来想去，骂完你后自己也不好受，害，早知道就不发评论了，无论站哪边，甚至不沾边都会被骂理中客，前面的第一句评论我不会删，后面的几句气话先抱歉，毕竟这真的很不文明。希望网络世界更加美好,2022年8月7日,(0)
Yelena-my-Love,赞同，双玩+1,2022年8月7日,(1)
Yelena-my-Love,又不是否定你的观点，网络世界因你更黑暗,2022年8月7日,(0)
看到记得喊我打卡谢谢,打卡,2022年8月7日,(1)
seed20,现在星寰出来了好多了,2022年8月7日,(0)
彡笙丶歌丿,说句实话就有人急了，咋办捏,2022年8月6日,(0)
Lukisama,别把无知当武器 多读书少敲键盘,2022年8月5日,(4)
Lukisama,一款好游戏遇到了错误的运营和数值 可惜,2022年8月5日,(0)
9别扭8,,2022年8月5日,(0)
RuAn-Asuka,什么op，原还强哈哈哈哈哈，牛的，真就年一游,2022年8月5日,(0)
RuAn-Asuka,不用打问号，很明显是op,2022年8月5日,(0)
森梨丶,哈哈笑死我了,2022年8月5日,(0)
Yelena-my-Love,这倒不至于，只能说各抒己见，个人认为原神已经是不错的游戏了,2022年8月4日,(0)
Yelena-my-Love,白鲸岛管家支线（不是咖啡那个）,2022年8月4日,(0)
Yelena-my-Love,这.......啊这,2022年8月4日,(0)
Oh_no_why,没人要克劳迪娅吗,2022年8月4日,(0)
千星落辰,？！你好刀客塔,2022年8月4日,(0)
Yelena-my-Love,未看子评论，预测楼主要被喷,2022年8月4日,(0)
Yelena-my-Love,捕获方舟玩家一只,2022年8月4日,(0)
Yelena-my-Love,这也可以喷啊.......,2022年8月4日,(0)
Yelena-my-Love,哈，希望如此吧,2022年8月4日,(0)
Yelena-my-Love,害，管他哩，我反正是来听歌的,2022年8月4日,(0)
Yelena-my-Love,支持不比较，我玩啥游戏看我心情，与周围看法无关（轻喷，怕疼）,2022年8月4日,(0)
Yelena-my-Love,玩游戏不混圈，快乐似神仙，把每个游戏当单机感觉世界美丽了好多,2022年8月4日,(4)
Yelena-my-Love,害，确实,2022年8月4日,(0)
Yelena-my-Love,这里也能吵起来，真无语（没有喷楼主的意思）,2022年8月4日,(0)
